{
  "$schema": "../../schemas/CharacterSpec.schema.json",
  "id": "char.kim",
  "name": "Kim",
  "description": "Our protagonist - aspiring lawyer turned Supreme Court champion",
  "ulpcArgs": {
    "body": "female",
    "skin": "olive",
    "hair": "long_straight",
    "hairColor": "black",
    "eyes": "brown",
    "torso": "formal_blouse",
    "legs": "pencil_skirt",
    "feet": "heels"
  },
  "animations": [
    "idle_down", "idle_up", "idle_left", "idle_right",
    "walk_down", "walk_up", "walk_left", "walk_right"
  ],
  "anims": {
    "idle_up":    { "frames": [91], "frameRate": 1, "repeat": 0 },
    "idle_left":  { "frames": [104], "frameRate": 1, "repeat": 0 },
    "idle_down":  { "frames": [117], "frameRate": 1, "repeat": 0 },
    "idle_right": { "frames": [130], "frameRate": 1, "repeat": 0 },
    "walk_up":    { "frames": [91,92,93,94,95,96,97,98,99], "frameRate": 10, "repeat": -1 },
    "walk_left":  { "frames": [104,105,106,107,108,109,110,111,112], "frameRate": 10, "repeat": -1 },
    "walk_down":  { "frames": [117,118,119,120,121,122,123,124,125], "frameRate": 10, "repeat": -1 },
    "walk_right": { "frames": [130,131,132,133,134,135,136,137,138], "frameRate": 10, "repeat": -1 }
  },
  "scale": 1,
  "variants": [
    {
      "variantId": "blazer",
      "ulpcOverrides": {
        "torso": "blazer"
      }
    },
    {
      "variantId": "power_suit",
      "ulpcOverrides": {
        "torso": "power_jacket",
        "legs": "dress_pants"
      }
    },
    {
      "variantId": "robe",
      "ulpcOverrides": {
        "torso": "judicial_robe"
      }
    }
  ]
}
